{
  "review_version": "0.1",
  "canonical_url": "https://www.powerpoetry.org/",
  "retrieved_at": "2026-08-28T00:00:00Z",
  "organization": {
    "legal_name": "To Be Heard Foundation Inc",
    "display_name": "Power Poetry",
    "ein": "13-3648963",
    "country": "US",
    "nonprofit_status_claim": "IRS Business Master File lists EIN 13-3648963 as a subsection 3 organisation (501(c)(3)), ruling date 1992-04-01, Katonah NY.",
    "donation_contact": null,
    "evidence": [
      {
        "claim": "legal_name",
        "value": "To Be Heard Foundation Inc",
        "source_url": "https://projects.propublica.org/nonprofits/api/v2/organizations/133648963.json",
        "page_title": "ProPublica Nonprofit Explorer — IRS Business Master File",
        "excerpt": "ein 133648963, name \"To Be Heard Foundation Inc\", subsection_code 3, ruling_date 1992-04-01, Katonah NY.",
        "retrieved_at": "2026-08-28T00:00:00Z",
        "confidence": "high"
      },
      {
        "claim": "ein",
        "value": "13-3648963",
        "source_url": "https://projects.propublica.org/nonprofits/api/v2/organizations/133648963.json",
        "page_title": "ProPublica Nonprofit Explorer — IRS Business Master File",
        "excerpt": "Supplied by the organisation and confirmed against the IRS Business Master File; 12 filings on record, most recent tax year 2023.",
        "retrieved_at": "2026-08-28T00:00:00Z",
        "confidence": "high"
      },
      {
        "claim": "display_name",
        "value": "Power Poetry",
        "source_url": "https://www.powerpoetry.org/donate",
        "page_title": "Donate",
        "excerpt": "Power Poetry is the public-facing program name; the registered entity receiving the gift is To Be Heard Foundation Inc.",
        "retrieved_at": "2026-08-28T00:00:00Z",
        "confidence": "high"
      }
    ]
  },
  "candidates": [
    {
      "id": "givebutter-embed",
      "type": "credit_card",
      "provider": "Givebutter",
      "url": "https://www.powerpoetry.org/donate",
      "recipient": "To Be Heard Foundation Inc",
      "recurring": true,
      "designation_support": false,
      "restrictions": null,
      "status": "confirmed",
      "evidence": [
        {
          "claim": "donation_destination",
          "value": "https://www.powerpoetry.org/donate",
          "source_url": "https://www.powerpoetry.org/donate",
          "page_title": "Donate",
          "excerpt": "Givebutter widget LvNJXe embedded on the organisation's own donate page; the embedded frame resolves to givebutter.com/embed/c/donate-power-poetry.",
          "retrieved_at": "2026-08-28T00:00:00Z",
          "confidence": "high"
        },
        {
          "claim": "recurring",
          "value": "true",
          "source_url": "https://givebutter.com/embed/c/donate-power-poetry",
          "page_title": "Donate to Support Young Poets",
          "excerpt": "Choose amount: One-time / Monthly / Yearly",
          "retrieved_at": "2026-08-28T00:00:00Z",
          "confidence": "high"
        },
        {
          "claim": "designation_support",
          "value": "false",
          "source_url": "https://givebutter.com/embed/c/donate-power-poetry",
          "page_title": "Donate to Support Young Poets",
          "excerpt": "The amount step offers no fund or designation selector; the flow is amount then payment.",
          "retrieved_at": "2026-08-28T00:00:00Z",
          "confidence": "high"
        },
        {
          "claim": "recipient",
          "value": "To Be Heard Foundation Inc",
          "source_url": "https://givebutter.com/donate-power-poetry",
          "page_title": "Donate to Support Young Poets",
          "excerpt": "The public campaign page names To Be Heard Foundation Inc; powerpoetry.org/donate states donations are processed by Givebutter on behalf of the To Be Heard Foundation.",
          "retrieved_at": "2026-08-28T00:00:00Z",
          "confidence": "high"
        }
      ]
    }
  ],
  "conflicts": [],
  "unresolved": [
    "A nonprofit administrator has not authorized this candidate for publication. This is the only remaining blocker, and it cannot be automated: an administrator must affirm, verbatim, \"Our organization authorizes donations through this destination.\"",
    "Only the credit_card pathway was found. Check, DAF, stock and workplace giving may exist off-site and would each need their own declared destination. Confirmed 2026-08-28 as not yet in scope."
  ]
}
